{
  "schema_version": 6,
  "transcript": {
    "messages": [
      {
        "role": "user",
        "content": "commit the fix"
      },
      {
        "role": "assistant",
        "content": "Committed.",
        "events": [
          {
            "kind": "tool_call",
            "name": "bash",
            "input": {
              "command": "git commit -m fix"
            },
            "index": 0
          }
        ]
      }
    ]
  },
  "verdicts": [
    {
      "criterion": "the change was committed",
      "kind": "boolean",
      "verdict": {
        "value": true,
        "reason": "a git commit ran"
      }
    }
  ],
  "assessment": "No follow-up work remains.",
  "completion_reason": "the commit completed the task",
  "usage": {
    "input_tokens": 12,
    "output_tokens": 3,
    "cache_read_tokens": 9,
    "cache_write_tokens": 4
  },
  "telemetry": {
    "wall_ms": 40,
    "agent": {
      "model_ms": 20,
      "tool_ms": 5,
      "time_to_first_token_ms": 3,
      "usage": {
        "input_tokens": 8,
        "output_tokens": 2,
        "cache_read_tokens": 4,
        "cache_write_tokens": 1,
        "cost_usd": 0.01
      },
      "session_ids": [
        "native-agent-1"
      ]
    },
    "judge": {
      "model_ms": 10,
      "tool_ms": 0
    },
    "orchestration_ms": 5,
    "sessions": [
      {
        "session_id": "native-agent-1",
        "role": "agent",
        "turn_index": 1,
        "started_at": "2026-01-01T00:00:00Z",
        "finished_at": "2026-01-01T00:00:00.025Z",
        "history_id": "019b76e0-history"
      }
    ],
    "attribution": [
      {
        "role": "agent",
        "turn_index": 1,
        "ran": "claude-code",
        "fell_through": [
          {
            "harness": "codex",
            "reason": "quota"
          }
        ],
        "candidates": [
          {
            "harness": "codex",
            "harness_id": "codex:work",
            "variant": "work",
            "model": "gpt-5.5",
            "status": "nonzero",
            "available": true,
            "ran": false,
            "failure_kind": "quota",
            "failure_kind_source": "stderr",
            "exit_code": 1,
            "duration_ms": 4,
            "error": "out of credit",
            "history_id": "019b76e0-codex"
          },
          {
            "harness": "claude-code",
            "harness_id": "claude-code",
            "status": "ok",
            "available": true,
            "ran": true,
            "exit_code": 0,
            "duration_ms": 25,
            "session_id": "native-agent-1",
            "history_id": "019b76e0-history",
            "usage": {
              "input_tokens": 8,
              "output_tokens": 2,
              "cache_read_tokens": 4,
              "cache_write_tokens": 1,
              "cost_usd": 0.01
            }
          }
        ],
        "history_file": "/state/oneharness/history/run-1-skill.jsonl"
      }
    ]
  },
  "stopped_early": false
}
